SYMBOL	Protein.names	Gene.Ontology..molecular.function.	Function..CC.
MBL2	Mannose-binding protein C (MBP-C) (Collectin-1) (MBP1) (Mannan-binding protein) (Mannose-binding lectin)	calcium-dependent protein binding [GO:0048306]; D-mannose binding [GO:0005537]; identical protein binding [GO:0042802]; signaling receptor binding [GO:0005102]	FUNCTION: Calcium-dependent lectin involved in innate immune defense (PubMed:35102342). Binds mannose, fucose and N-acetylglucosamine on different microorganisms and activates the lectin complement pathway. Binds to late apoptotic cells, as well as to apoptotic blebs and to necrotic cells, but not to early apoptotic cells, facilitating their uptake by macrophages. May bind DNA. Upon SARS coronavirus-2/SARS-CoV-2 infection, activates the complement lectin pathway which leads to the inhibition SARS-CoV-2 infection and a reduction of the induced inflammatory response (PubMed:35102342). {ECO:0000269|PubMed:14515269, ECO:0000269|PubMed:35102342}.
FLG	Fibroblast growth factor receptor 1 (FGFR-1) (EC 2.7.10.1) (Basic fibroblast growth factor receptor 1) (BFGFR) (bFGF-R-1) (Fms-like tyrosine kinase 2) (FLT-2) (N-sam) (Proto-oncogene c-Fgr) (CD antigen CD331)	ATP binding [GO:0005524]; fibroblast growth factor binding [GO:0017134]; fibroblast growth factor receptor activity [GO:0005007]; heparin binding [GO:0008201]; identical protein binding [GO:0042802]; protein homodimerization activity [GO:0042803]; protein tyrosine kinase activity [GO:0004713]; receptor-receptor interaction [GO:0090722]; SH2 domain binding [GO:0042169]	FUNCTION: Tyrosine-protein kinase that acts as a cell-surface receptor for fibroblast growth factors and plays an essential role in the regulation of embryonic development, cell proliferation, differentiation and migration. Required for normal mesoderm patterning and correct axial organization during embryonic development, normal skeletogenesis and normal development of the gonadotropin-releasing hormone (GnRH) neuronal system. Phosphorylates PLCG1, FRS2, GAB1 and SHB. Ligand binding leads to the activation of several signaling cascades. Activation of PLCG1 leads to the production of the cellular signaling molecules diacylglycerol and inositol 1,4,5-trisphosphate. Phosphorylation of FRS2 triggers recruitment of GRB2, GAB1, PIK3R1 and SOS1, and mediates activation of RAS, MAPK1/ERK2, MAPK3/ERK1 and the MAP kinase signaling pathway, as well as of the AKT1 signaling pathway. Promotes phosphorylation of SHC1, STAT1 and PTPN11/SHP2. In the nucleus, enhances RPS6KA1 and CREB1 activity and contributes to the regulation of transcription. FGFR1 signaling is down-regulated by IL17RD/SEF, and by FGFR1 ubiquitination, internalization and degradation. {ECO:0000250|UniProtKB:P16092, ECO:0000269|PubMed:10830168, ECO:0000269|PubMed:11353842, ECO:0000269|PubMed:12181353, ECO:0000269|PubMed:1379697, ECO:0000269|PubMed:1379698, ECO:0000269|PubMed:15117958, ECO:0000269|PubMed:16597617, ECO:0000269|PubMed:17311277, ECO:0000269|PubMed:17623664, ECO:0000269|PubMed:18480409, ECO:0000269|PubMed:19224897, ECO:0000269|PubMed:19261810, ECO:0000269|PubMed:19665973, ECO:0000269|PubMed:20133753, ECO:0000269|PubMed:20139426, ECO:0000269|PubMed:21765395, ECO:0000269|PubMed:8622701, ECO:0000269|PubMed:8663044}.
CYP4B1	Cytochrome P450 4B1 (EC 1.14.14.1) (CYPIVB1) (Cytochrome P450-HP)	aromatase activity [GO:0070330]; heme binding [GO:0020037]; heterocyclic compound binding [GO:1901363]; iron ion binding [GO:0005506]; monooxygenase activity [GO:0004497]; oxygen binding [GO:0019825]	FUNCTION: Cytochromes P450 are a group of heme-thiolate monooxygenases. In liver microsomes, this enzyme is involved in an NADPH-dependent electron transport pathway. It oxidizes a variety of structurally unrelated compounds, including steroids, fatty acids, and xenobiotics.
TYR	Tyrosinase (EC 1.14.18.1) (LB24-AB) (Monophenol monooxygenase) (SK29-AB) (Tumor rejection antigen AB)	copper ion binding [GO:0005507]; identical protein binding [GO:0042802]; protein homodimerization activity [GO:0042803]; tyrosinase activity [GO:0004503]	FUNCTION: This is a copper-containing oxidase that functions in the formation of pigments such as melanins and other polyphenolic compounds. Catalyzes the initial and rate limiting step in the cascade of reactions leading to melanin production from tyrosine (By similarity). In addition to hydroxylating tyrosine to DOPA (3,4-dihydroxyphenylalanine), also catalyzes the oxidation of DOPA to DOPA-quinone, and possibly the oxidation of DHI (5,6-dihydroxyindole) to indole-5,6 quinone (PubMed:28661582). {ECO:0000250|UniProtKB:P11344, ECO:0000269|PubMed:28661582}.
HTN3	Histatin-3 (Basic histidine-rich protein) (Hst) (Histatin 3) (Hst 3) (Histidine-rich protein 3) (PB) [Cleaved into: Histatin-3; His3-(20-44)-peptide (His3 20/44) (His3-(1-25)-peptide) (His3 1/25) (Histatin 6) (Histatin-3 1/25) (Histatin-6); His3-(20-43)-peptide (His3 20/43) (His3-(1-24)-peptide) (His3 1/24) (Histatin 5) (Hst 5) (Histatin-3 1/24) (Histatin-5); His3-(20-32)-peptide (His3 20/32) (His3-(1-13)-peptide) (His3 1/13) (Histatin-3 1/13); His3-(20-31)-peptide (His3 20/31) (His3-(1-12)-peptide) (His3 1/12) (Histatin-3 1/12); His3-(20-30)-peptide (His3 20/30) (His3-(1-11)-peptide) (His3 1/11) (Histatin-3 1/11); His3-(24-32)-peptide (His3 24/32) (His3-(5-13)-peptide) (His3 5/13) (Histatin-3 5/13); His3-(24-31)-peptide (His3 24/31) (His3-(5-12)-peptide) (His3 5/12) (Histatin 11) (Histatin-11) (Histatin-3 5/12); His3-(24-30)-peptide (His3 24/30) (His3-(5-11)-peptide) (His3 5/11) (Histatin 12) (Histatin-12) (Histatin-3 5/11); His3-(25-32)-peptide (His3 25/32) (His3-(6-13)-peptide) (His3 6/13) (Histatin-3 6/13); His3-(25-30)-peptide (His3 25/30) (His3-(6-11)-peptide) (His3 6/11) (Histatin-3 6/11); His3-(26-32)-peptide (His3 26/32) (His3-(7-13)-peptide) (His3 7/13) (Histatin-3 7/13); His3-(26-31)-peptide (His3 26/31) (His3-(7-12)-peptide) (His3 7/12) (Histatin-3 7/12); His3-(26-30)-peptide (His3 26/30) (His3-(7-11)-peptide) (His3 7/11) (Histatin-3 7/11); His3-(31-51)-peptide (His3 31/51) (His3-(12-32)-peptide) (His3 12/32) (Histatin 4) (Histatin-3 12/32) (Histatin-4); His3-(31-44)-peptide (His3 31/44) (His3-(12-25)-peptide) (His3 12/25) (Histatin 9) (Histatin-3 12/25) (Histatin-9); His3-(31-43)-peptide (His3 31/43) (His3-(12-24)-peptide) (His3 12/24) (Histatin 7) (Histatin-3 12/24) (Histatin-7); His3-(32-44)-peptide (His3 32/44) (His3-(13-25)-peptide) (His3 13/25) (Histatin 10) (Histatin-10) (Histatin-3 13/25); His3-(32-43)-peptide (His3 32-43) (His3-(13-24)-peptide) (His3 13/24) (Histatin 8) (Histatin-3 13/24) (Histatin-8); His3-(33-44)-peptide (His3 33/44) (His3-(14-25)-peptide) (His3 14/25) (Histatin-3 14/25); His3-(33-43)-peptide (His3 33/43) (His3-(14-24)-peptide) (His3 14/24) (Histatin-3 14/24); His3-(34-44)-peptide (His3 34/44) (His3-(15-25)-peptide) (His3 15/25) (Histatin-3 15/25); His3-(34-43)-peptide (His3 34/43) (His3-(15-24)-peptide) (His3 15/24) (Histatin-3 15/24); His3-(45-51)-peptide (His3 45/51) (His3-(26-32)-peptide) (His3 26/32) (Histatin-3 26/32); His3-(47-51)-peptide (His3 47/51) (His3-(28-32)-peptide) (His3 28/32) (Histatin-3 28/32); His3-(48-51)-peptide (His3 48/51) (His3-(29-32)-peptide) (His3 29/32) (Histatin-3 29/32)]	metal ion binding [GO:0046872]; molecular adaptor activity [GO:0060090]	FUNCTION: Histatins are cationic and histidine-rich peptides mainly found in the saliva of higher primates (PubMed:3286634). They are considered to be major precursors of the protective proteinaceous structure on tooth surfaces (enamel pellicle). Hsts can be divided into two major groups according to their biological functions: antimicrobial Hsts (e.g. Hst 5/HTN3) and cell-activating Hsts (e.g. Hst 1/HTN1, Hst 2/HTN1 and Hst 3/HTN3) (PubMed:32225006). {ECO:0000269|PubMed:32225006, ECO:0000269|PubMed:3286634}.; FUNCTION: [Histatin-3]: Histatin 3 (Hst 3) is mostly involved in cell migration and wound healing in the oral cavity (PubMed:18650243). Also stimulates cell proliferation after binding to heat shock protein HSC70, which enhances HSC70-CDKN1B complex formation and subsequent ubiquitination during G1/S transition (PubMed:26775844). Also displays antifungal activity against pathogenic yeast Candida albicans, however with less effectiveness than Hst 5 (PubMed:11083804, PubMed:3286634). {ECO:0000269|PubMed:11083804, ECO:0000269|PubMed:18650243, ECO:0000269|PubMed:26775844, ECO:0000269|PubMed:3286634}.; FUNCTION: [His3-(20-43)-peptide]: Histatin 5 (Hst 5), a fragment of Hst 3, is the major histatin exhibiting antifungal and antibacterial activities (PubMed:10066791, PubMed:11083804, PubMed:11179305, PubMed:11717389, PubMed:12939362, PubMed:15485849, PubMed:2372245, PubMed:8945538). It is effective against pathogenic yeast C. albicans, C. neoformans, C. glabrata and S. cerevisiae as well as ESKAPE bacterial pathogens (PubMed:18974864, PubMed:23613860, PubMed:2372245, PubMed:28261570, PubMed:8945538). Secreted Hst 5 mediates a multi-step intracellular mechanism of action against the pathogen. Depending on peptide concentration and pathogen, uptake across the membrane can occur through transporters, direct interaction with plasma membrane and/or receptor-mediated endocytosis (PubMed:18974864, PubMed:20487276, PubMed:28261570). Binds C. albicans cell wall proteins SSA1 and SSA2 and glycans in an energy-independent manner, then is taken up by the cells through fungal polyamine transporters DUR3 and DUR31 in an energy-dependent manner (PubMed:12761219, PubMed:20487276, PubMed:22033918, PubMed:23613860). Internalized Hst5 is then targeted to the energized mitochondrion to induce reactive oxygen species (ROS) formation and subsequent release of intracellular non-lytic ATP which ultimately leads to fungal cell death (PubMed:10066791, PubMed:11083804, PubMed:11717389). In addition, inhibits C. albicans TRK1 potassium-transporter which causes exudation of intracellular K(+), generating an osmotic imbalance leading to delayed membrane lysis and cell death (PubMed:15485849). Also acts as a potent inhibitor of bacterial proteases such as Lys-gingipain and Arg-gingipain (rgpB) from P. gingivalis as well as human metalloproteases MMP2 and MMP9 (PubMed:11179305). The binding of metals such as zinc, copper or nickel with Hst 5 results in the protection of the enamel and antimicrobial activities such as the inhibition of microbial growth by decreasing the metal concentration, the formation of ROS commonly associated with redox-active metals, the induction of membrane disruption mediated by zinc binding (PubMed:19846304, PubMed:28261570, PubMed:28763199, PubMed:32751915). Also involved in coating oral surfaces in the form of a salivary film which reduces colonization by C. albicans on epithelial cell surfaces (PubMed:26379655). Secreted Hst 5 can also internalize mammalian epithelial cells and target the mitochondria although it does not exert cytotoxic effects in these cells (PubMed:32225006). In contrast with Hst 3, not able to promote wound healing in mammalian host cells (PubMed:18650243). {ECO:0000269|PubMed:10066791, ECO:0000269|PubMed:11083804, ECO:0000269|PubMed:11179305, ECO:0000269|PubMed:11717389, ECO:0000269|PubMed:12761219, ECO:0000269|PubMed:12939362, ECO:0000269|PubMed:15485849, ECO:0000269|PubMed:18650243, ECO:0000269|PubMed:18974864, ECO:0000269|PubMed:19846304, ECO:0000269|PubMed:20487276, ECO:0000269|PubMed:22033918, ECO:0000269|PubMed:23613860, ECO:0000269|PubMed:2372245, ECO:0000269|PubMed:26379655, ECO:0000269|PubMed:28261570, ECO:0000269|PubMed:28763199, ECO:0000269|PubMed:32225006, ECO:0000269|PubMed:32751915, ECO:0000269|PubMed:8945538}.
TCN2	Transcobalamin-2 (TC-2) (Transcobalamin II) (TC II) (TCII)	cargo receptor ligand activity [GO:0140355]; cobalamin binding [GO:0031419]; metal ion binding [GO:0046872]	FUNCTION: Primary vitamin B12-binding and transport protein. Delivers cobalamin to cells. {ECO:0000269|PubMed:8443384}.
FLG	Filaggrin	calcium ion binding [GO:0005509]; structural constituent of skin epidermis [GO:0030280]; transition metal ion binding [GO:0046914]	FUNCTION: Aggregates keratin intermediate filaments and promotes disulfide-bond formation among the intermediate filaments during terminal differentiation of mammalian epidermis.
AMPD1	AMP deaminase 1 (EC 3.5.4.6) (AMP deaminase isoform M) (Myoadenylate deaminase)	AMP deaminase activity [GO:0003876]; identical protein binding [GO:0042802]; metal ion binding [GO:0046872]	FUNCTION: AMP deaminase plays a critical role in energy metabolism. {ECO:0000269|PubMed:11102975}.
CMA1	Chymase (EC 3.4.21.39) (Alpha-chymase) (Mast cell protease I)	endopeptidase activity [GO:0004175]; peptide binding [GO:0042277]; serine-type endopeptidase activity [GO:0004252]; serine-type peptidase activity [GO:0008236]	FUNCTION: Major secreted protease of mast cells with suspected roles in vasoactive peptide generation, extracellular matrix degradation, and regulation of gland secretion.
FMO2	Dimethylaniline monooxygenase [N-oxide-forming] 4 (EC 1.14.13.8) (Dimethylaniline oxidase 4) (Hepatic flavin-containing monooxygenase 4) (FMO 4)	flavin adenine dinucleotide binding [GO:0050660]; hypotaurine dehydrogenase activity [GO:0047822]; N,N-dimethylaniline monooxygenase activity [GO:0004499]; NADP binding [GO:0050661]	FUNCTION: This protein is involved in the oxidative metabolism of a variety of xenobiotics such as drugs and pesticides.
SERPINB5	Serpin B5 (Maspin) (Peptidase inhibitor 5) (PI-5)	serine-type endopeptidase inhibitor activity [GO:0004867]	FUNCTION: Tumor suppressor. It blocks the growth, invasion, and metastatic properties of mammary tumors. As it does not undergo the S (stressed) to R (relaxed) conformational transition characteristic of active serpins, it exhibits no serine protease inhibitory activity.
IL6ST	Interleukin-6 receptor subunit beta (IL-6 receptor subunit beta) (IL-6R subunit beta) (IL-6R-beta) (IL-6RB) (CDw130) (Interleukin-6 signal transducer) (Membrane glycoprotein 130) (gp130) (Oncostatin-M receptor subunit alpha) (CD antigen CD130)	ciliary neurotrophic factor receptor activity [GO:0004897]; ciliary neurotrophic factor receptor binding [GO:0005127]; coreceptor activity [GO:0015026]; cytokine binding [GO:0019955]; cytokine receptor activity [GO:0004896]; growth factor binding [GO:0019838]; identical protein binding [GO:0042802]; interleukin-11 binding [GO:0019970]; interleukin-11 receptor activity [GO:0004921]; interleukin-27 receptor activity [GO:0045509]; protein tyrosine kinase activator activity [GO:0030296]; scaffold protein binding [GO:0097110]	FUNCTION: Signal-transducing molecule (PubMed:2261637). The receptor systems for IL6, LIF, OSM, CNTF, IL11, CTF1 and BSF3 can utilize IL6ST for initiating signal transmission. Binding of IL6 to IL6R induces IL6ST homodimerization and formation of a high-affinity receptor complex, which activates the intracellular JAK-MAPK and JAK-STAT3 signaling pathways (PubMed:19915009, PubMed:2261637, PubMed:23294003). That causes phosphorylation of IL6ST tyrosine residues which in turn activates STAT3 (PubMed:19915009, PubMed:23294003, PubMed:25731159). In parallel, the IL6 signaling pathway induces the expression of two cytokine receptor signaling inhibitors, SOCS1 and SOCS3, which inhibit JAK and terminate the activity of the IL6 signaling pathway as a negative feedback loop (By similarity). Also activates the yes-associated protein 1 (YAP) and NOTCH pathways to control inflammation-induced epithelial regeneration, independently of STAT3 (By similarity). Acts as a receptor for the neuroprotective peptide humanin as part of a complex with IL27RA/WSX1 and CNTFR (PubMed:19386761). Mediates signals which regulate immune response, hematopoiesis, pain control and bone metabolism (By similarity). Has a role in embryonic development (By similarity). Essential for survival of motor and sensory neurons and for differentiation of astrocytes (By similarity). Required for expression of TRPA1 in nociceptive neurons (By similarity). Required for the maintenance of PTH1R expression in the osteoblast lineage and for the stimulation of PTH-induced osteoblast differentiation (By similarity). Required for normal trabecular bone mass and cortical bone composition (By similarity). {ECO:0000250|UniProtKB:Q00560, ECO:0000269|PubMed:19386761, ECO:0000269|PubMed:19915009, ECO:0000269|PubMed:2261637, ECO:0000269|PubMed:23294003, ECO:0000269|PubMed:25731159, ECO:0000269|PubMed:28747427, ECO:0000269|PubMed:30309848}.; FUNCTION: [Isoform 2]: Binds to the soluble IL6:sIL6R complex (hyper-IL6), thereby blocking IL6 trans-signaling. Inhibits sIL6R-dependent acute phase response (PubMed:11121117, PubMed:21990364, PubMed:30279168). Also blocks IL11 cluster signaling through IL11R (PubMed:30279168). {ECO:0000269|PubMed:11121117, ECO:0000269|PubMed:21990364, ECO:0000269|PubMed:30279168}.
MTHFR	Methylenetetrahydrofolate reductase (NADPH) (EC 1.5.1.53)	FAD binding [GO:0071949]; flavin adenine dinucleotide binding [GO:0050660]; methylenetetrahydrofolate reductase (NAD(P)H) activity [GO:0004489]; methylenetetrahydrofolate reductase (NADPH) activity [GO:0106313]; modified amino acid binding [GO:0072341]; NADP binding [GO:0050661]; protein-containing complex binding [GO:0044877]	FUNCTION: Catalyzes the conversion of 5,10-methylenetetrahydrofolate to 5-methyltetrahydrofolate, a cosubstrate for homocysteine remethylation to methionine (PubMed:29891918). Represents a key regulatory connection between the folate and methionine cycles (Probable). {ECO:0000269|PubMed:25736335, ECO:0000269|PubMed:29891918, ECO:0000305}.
ALDH3B2	Aldehyde dehydrogenase family 3 member B2 (ALDH3B2) (EC 1.2.1.3) (Aldehyde dehydrogenase 8) (Long-chain fatty aldehyde dehydrogenase) (EC 1.2.1.48)	3-chloroallyl aldehyde dehydrogenase activity [GO:0004028]; aldehyde dehydrogenase (NAD+) activity [GO:0004029]; aldehyde dehydrogenase [NAD(P)+] activity [GO:0004030]	FUNCTION: Oxidizes medium and long chain fatty aldehydes in lipid droplets into non-toxic fatty acids. {ECO:0000250|UniProtKB:E9Q3E1}.
SLC26A2	Sulfate transporter (Diastrophic dysplasia protein) (Solute carrier family 26 member 2)	bicarbonate transmembrane transporter activity [GO:0015106]; chloride transmembrane transporter activity [GO:0015108]; oxalate transmembrane transporter activity [GO:0019531]; secondary active sulfate transmembrane transporter activity [GO:0008271]; solute:inorganic anion antiporter activity [GO:0005452]; sulfate transmembrane transporter activity [GO:0015116]	FUNCTION: Sulfate transporter which mediates sulfate uptake into chondrocytes in order to maintain adequate sulfation of proteoglycans which is needed for cartilage development (PubMed:11448940, PubMed:15294877, PubMed:20219950, PubMed:7923357). Mediates electroneutral anion exchange of sulfate ions for oxalate ions and of sulfate and oxalate ions for chloride ions (PubMed:20219950). Mediates exchange of sulfate and oxalate ions for hydroxyl ions and of chloride ions for bromide, iodide and nitrate ions (By similarity). The coupling of sulfate transport to both hydroxyl and chloride ions likely serves to ensure transport at both acidic pH when most sulfate uptake is mediated by sulfate-hydroxide exchange and alkaline pH when most sulfate uptake is mediated by sulfate-chloride exchange (By similarity). Essential for chondrocyte proliferation, differentiation and cell size expansion (By similarity). {ECO:0000250|UniProtKB:Q62273, ECO:0000269|PubMed:11448940, ECO:0000269|PubMed:15294877, ECO:0000269|PubMed:20219950, ECO:0000269|PubMed:7923357}.
DNA2	DNA replication ATP-dependent helicase/nuclease DNA2 (hDNA2) (DNA replication ATP-dependent helicase-like homolog) [Includes: DNA replication nuclease DNA2 (EC 3.1.-.-); DNA replication ATP-dependent helicase DNA2 (EC 3.6.4.12)]	4 iron, 4 sulfur cluster binding [GO:0051539]; 5'-3' DNA helicase activity [GO:0043139]; 5'-flap endonuclease activity [GO:0017108]; ATP binding [GO:0005524]; ATP hydrolysis activity [GO:0016887]; DNA binding [GO:0003677]; DNA helicase activity [GO:0003678]; helicase activity [GO:0004386]; metal ion binding [GO:0046872]; nuclease activity [GO:0004518]; RNA binding [GO:0003723]; single-stranded DNA helicase activity [GO:0017116]; site-specific endodeoxyribonuclease activity, specific for altered base [GO:0016890]	FUNCTION: Key enzyme involved in DNA replication and DNA repair in nucleus and mitochondrion. Involved in Okazaki fragments processing by cleaving long flaps that escape FEN1: flaps that are longer than 27 nucleotides are coated by replication protein A complex (RPA), leading to recruit DNA2 which cleaves the flap until it is too short to bind RPA and becomes a substrate for FEN1. Also involved in 5'-end resection of DNA during double-strand break (DSB) repair: recruited by BLM and mediates the cleavage of 5'-ssDNA, while the 3'-ssDNA cleavage is prevented by the presence of RPA. Also involved in DNA replication checkpoint independently of Okazaki fragments processing. Possesses different enzymatic activities, such as single-stranded DNA (ssDNA)-dependent ATPase, 5'-3' helicase and endonuclease activities. While the ATPase and endonuclease activities are well-defined and play a key role in Okazaki fragments processing and DSB repair, the 5'-3' DNA helicase activity is subject to debate. According to various reports, the helicase activity is weak and its function remains largely unclear. Helicase activity may promote the motion of DNA2 on the flap, helping the nuclease function. {ECO:0000269|PubMed:16595799, ECO:0000269|PubMed:16595800, ECO:0000269|PubMed:18995831, ECO:0000269|PubMed:19487465, ECO:0000269|PubMed:21325134, ECO:0000269|PubMed:21572043, ECO:0000269|PubMed:22570407, ECO:0000269|PubMed:22570476, ECO:0000269|PubMed:31478350}.
TPTE	Putative tyrosine-protein phosphatase TPTE (EC 3.1.3.48) (Cancer/testis antigen 44) (CT44) (Transmembrane phosphatase with tensin homology) (Tumor antigen BJ-HCC-5)	monoatomic ion channel activity [GO:0005216]; phosphatidylinositol-3,4,5-trisphosphate 3-phosphatase activity [GO:0016314]; protein tyrosine phosphatase activity [GO:0004725]	FUNCTION: Could be involved in signal transduction.
CACNA1B	Voltage-dependent N-type calcium channel subunit alpha-1B (Brain calcium channel III) (BIII) (Calcium channel, L type, alpha-1 polypeptide isoform 5) (Voltage-gated calcium channel subunit alpha Cav2.2)	amyloid-beta binding [GO:0001540]; ATP binding [GO:0005524]; calcium ion binding [GO:0005509]; high voltage-gated calcium channel activity [GO:0008331]; voltage-gated calcium channel activity [GO:0005245]	FUNCTION: Voltage-sensitive calcium channels (VSCC) mediate the entry of calcium ions into excitable cells and are also involved in a variety of calcium-dependent processes, including muscle contraction, hormone or neurotransmitter release, gene expression, cell motility, cell division and cell death. This alpha-1B subunit gives rise to N-type calcium currents. N-type calcium channels belong to the 'high-voltage activated' (HVA) group. They are involved in pain signaling (PubMed:25296916). Calcium channels containing alpha-1B subunit may play a role in directed migration of immature neurons. Mediates Ca(2+) release probability at hippocampal neuronal soma and synaptic terminals (By similarity). {ECO:0000250|UniProtKB:Q02294, ECO:0000269|PubMed:25296916}.; FUNCTION: [Isoform Alpha-1B-1]: Voltage-sensitive calcium channels (VSCC) mediate the entry of calcium ions into excitable cells and are also involved in a variety of calcium-dependent processes, including muscle contraction, hormone or neurotransmitter release, gene expression, cell motility, cell division and cell death. This alpha-1B subunit gives rise to N-type calcium currents. {ECO:0000269|PubMed:1321501}.
IL5RA	Interleukin-5 receptor subunit alpha (IL-5 receptor subunit alpha) (IL-5R subunit alpha) (IL-5R-alpha) (IL-5RA) (CDw125) (CD antigen CD125)	cytokine binding [GO:0019955]; cytokine receptor activity [GO:0004896]; interleukin-5 receptor activity [GO:0004914]	FUNCTION: Cell surface receptor that plays an important role in the survival, differentiation, and chemotaxis of eosinophils (PubMed:9378992). Acts by forming a heterodimeric receptor with CSF2RB subunit and subsequently binding to interleukin-5 (PubMed:1495999, PubMed:22528658). In unstimulated conditions, interacts constitutively with JAK2. Heterodimeric receptor activation leads to JAK2 stimulation and subsequent activation of the JAK-STAT pathway (PubMed:9516124). {ECO:0000269|PubMed:1495999, ECO:0000269|PubMed:22528658, ECO:0000269|PubMed:9378992, ECO:0000269|PubMed:9516124}.
