SYMBOL	Protein.names	Gene.Ontology..molecular.function.	Function..CC.
DYNC2H1	Cytoplasmic dynein 2 heavy chain 1 (Cytoplasmic dynein 2 heavy chain) (Dynein cytoplasmic heavy chain 2) (Dynein heavy chain 11) (hDHC11) (Dynein heavy chain isotype 1B)	ATP binding [GO:0005524]; ATP hydrolysis activity [GO:0016887]; cytoskeletal motor activity [GO:0003774]; dynein intermediate chain binding [GO:0045505]; dynein light intermediate chain binding [GO:0051959]; minus-end-directed microtubule motor activity [GO:0008569]	FUNCTION: May function as a motor for intraflagellar retrograde transport. Functions in cilia biogenesis. May play a role in transport between endoplasmic reticulum and Golgi or organization of the Golgi in cells (By similarity). {ECO:0000250}.
PDPR	Pyruvate dehydrogenase phosphatase regulatory subunit, mitochondrial (PDPr)	NA	FUNCTION: Decreases the sensitivity of PDP1 to magnesium ions, and this inhibition is reversed by the polyamine spermine. {ECO:0000250}.
SLAIN1	SLAIN motif-containing protein 1	NA	FUNCTION: Microtubule plus-end tracking protein that might be involved in the regulation of cytoplasmic microtubule dynamics, microtubule organization and microtubule elongation. {ECO:0000269|PubMed:21646404}.
OR52N4	Olfactory receptor 52N4 (Olfactory receptor OR11-64)	G protein-coupled receptor activity [GO:0004930]; olfactory receptor activity [GO:0004984]	FUNCTION: Odorant receptor. {ECO:0000305}.
OR4A16	Olfactory receptor 4A16 (Olfactory receptor OR11-117)	G protein-coupled receptor activity [GO:0004930]; olfactory receptor activity [GO:0004984]	FUNCTION: Odorant receptor. {ECO:0000305}.
CCHCR1	Coiled-coil alpha-helical rod protein 1 (Alpha-helical coiled-coil rod protein) (Putative gene 8 protein) (Pg8)	identical protein binding [GO:0042802]	FUNCTION: May be a regulator of keratinocyte proliferation or differentiation.
TMC1	Transmembrane channel-like protein 1 (Transmembrane cochlear-expressed protein 1)	calcium channel activity [GO:0005262]; mechanosensitive monoatomic ion channel activity [GO:0008381]; voltage-gated calcium channel activity [GO:0005245]	FUNCTION: Pore-forming subunit of the mechanotransducer (MET) non-selective cation channel complex located at the tips of stereocilia of cochlear hair cells and that mediates sensory transduction in the auditory system (By similarity). The MET complex is composed of two dimeric pore-forming ion-conducting transmembrane TMC (TMC1 or TMC2) subunits, and aided by several auxiliary proteins including LHFPL5, TMIE, CIB2/3 and TOMT, and the tip-link PCDH15 (By similarity). MET channel is activated by tension in the tip-link extending from the side wall of one stereocilium to the tip of the adjacent shorter stereocilium, where the channel is located (By similarity). TMC1 MET channel is highly permeable to calcium and likely transports monovalent cations (By similarity). Also involved in vestibular hair cells transduction current (By similarity). {ECO:0000250|UniProtKB:Q8R4P5}.
PRUNE2	Protein prune homolog 2 (BNIP2 motif-containing molecule at the C-terminal region 1)	metal ion binding [GO:0046872]; pyrophosphatase activity [GO:0016462]	FUNCTION: May play an important role in regulating differentiation, survival and aggressiveness of the tumor cells. {ECO:0000269|PubMed:16288218}.
RIN2	Ras and Rab interactor 2 (Ras association domain family 4) (Ras inhibitor JC265) (Ras interaction/interference protein 2)	GTPase activator activity [GO:0005096]; GTPase regulator activity [GO:0030695]; guanyl-nucleotide exchange factor activity [GO:0005085]; small GTPase binding [GO:0031267]	FUNCTION: Ras effector protein. May function as an upstream activator and/or downstream effector for RAB5B in endocytic pathway. May function as a guanine nucleotide exchange (GEF) of RAB5B, required for activating the RAB5 proteins by exchanging bound GDP for free GTP. {ECO:0000269|PubMed:11733506}.
P2RX5	P2X purinoceptor 5 (P2X5) (ATP receptor) (Purinergic receptor)	ATP binding [GO:0005524]; ATP-gated ion channel activity [GO:0035381]; extracellularly ATP-gated monoatomic cation channel activity [GO:0004931]; ligand-gated monoatomic anion channel activity [GO:0099095]; monoatomic ion channel activity [GO:0005216]; purinergic nucleotide receptor activity [GO:0001614]; transmembrane signaling receptor activity [GO:0004888]	FUNCTION: [Isoform 6]: ATP-gated nonselective transmembrane cation channel permeable to potassium, sodium and calcium (PubMed:12761352). Unlike, other P2RX receptors, the P2X5 receptor is also permeable to chloride (PubMed:12761352). May play a supporting role in the inflammatory response (By similarity). {ECO:0000250|UniProtKB:Q91VE2, ECO:0000269|PubMed:12761352}.; FUNCTION: [Isoform 1]: Non-functional. {ECO:0000269|PubMed:9414125}.
MYO19	Unconventional myosin-XIX (Myosin head domain-containing protein 1)	actin binding [GO:0003779]; actin filament binding [GO:0051015]; ATP binding [GO:0005524]; ATP hydrolysis activity [GO:0016887]; microfilament motor activity [GO:0000146]; myosin light chain binding [GO:0032027]; plus-end directed microfilament motor activity [GO:0060002]	FUNCTION: Actin-based motor molecule with ATPase activity that localizes to the mitochondrion outer membrane (PubMed:19932026, PubMed:23568824, PubMed:25447992). Motor protein that moves towards the plus-end of actin filaments (By similarity). Required for mitochondrial inheritance during mitosis (PubMed:25447992). May be involved in mitochondrial transport or positioning (PubMed:23568824). {ECO:0000250|UniProtKB:Q5SV80, ECO:0000269|PubMed:19932026, ECO:0000269|PubMed:25447992, ECO:0000305|PubMed:23568824}.
NT5C1B	Cytosolic 5'-nucleotidase 1B (cN1B) (EC 3.1.3.5) (Autoimmune infertility-related protein) (Cytosolic 5'-nucleotidase IB) (cN-IB)	5'-nucleotidase activity [GO:0008253]; magnesium ion binding [GO:0000287]; nucleotide binding [GO:0000166]; XMP 5'-nucleosidase activity [GO:0106411]	FUNCTION: Catalyzes the hydrolysis of nucleotide monophosphates, releasing inorganic phosphate and the corresponding nucleoside, AMP is the major substrate. {ECO:0000250|UniProtKB:Q91YE9}.
AGAP3	Arf-GAP with GTPase, ANK repeat and PH domain-containing protein 3 (AGAP-3) (CRAM-associated GTPase) (CRAG) (Centaurin-gamma-3) (Cnt-g3) (MR1-interacting protein) (MRIP-1)	GTP binding [GO:0005525]; GTPase activator activity [GO:0005096]; GTPase activity [GO:0003924]; metal ion binding [GO:0046872]; polyubiquitin modification-dependent protein binding [GO:0031593]	FUNCTION: GTPase-activating protein for the ADP ribosylation factor family (Potential). GTPase which may be involved in the degradation of expanded polyglutamine proteins through the ubiquitin-proteasome pathway. {ECO:0000269|PubMed:16461359, ECO:0000305}.
FMO2	Flavin-containing monooxygenase 2 (EC 1.14.13.-) (Dimethylaniline oxidase 2) (FMO 1B1) (Pulmonary flavin-containing monooxygenase 2) (FMO 2)	flavin adenine dinucleotide binding [GO:0050660]; hypotaurine dehydrogenase activity [GO:0047822]; N,N-dimethylaniline monooxygenase activity [GO:0004499]; NADP binding [GO:0050661]	FUNCTION: Catalyzes the oxidative metabolism of numerous xenobiotics, including mainly therapeutic drugs and insecticides that contain a soft nucleophile, most commonly nitrogen and sulfur and participates to their bioactivation (PubMed:15144220, PubMed:15294458, PubMed:18930751, PubMed:18948378, PubMed:9804831). Specifically catalyzes S-oxygenation of sulfur derived compounds such as thioureas-derived compounds, thioetherorganophosphates to their sulfenic acid (PubMed:15144220, PubMed:9804831). In vitro, catalyzes S-oxygenation of the second-line antitubercular drugs thiacetazone (TAZ) and ethionamide (ETA), forming a sulfinic acid and a carbodiimide via a postulated sulfenic acid intermediate (PubMed:18930751, PubMed:18948378). Also catalyzes S-oxygenation of the thioether-containing organophosphate insecticides, phorate and disulfoton (PubMed:15294458). {ECO:0000269|PubMed:15144220, ECO:0000269|PubMed:15294458, ECO:0000269|PubMed:18930751, ECO:0000269|PubMed:18948378, ECO:0000269|PubMed:9804831}.
FYCO1	FYVE and coiled-coil domain-containing protein 1 (Zinc finger FYVE domain-containing protein 7)	metal ion binding [GO:0046872]	FUNCTION: May mediate microtubule plus end-directed vesicle transport. {ECO:0000269|PubMed:20100911}.
SELENOO	Protein adenylyltransferase SelO, mitochondrial (EC 2.7.7.-) (EC 2.7.7.108) (Selenoprotein O) (SelO)	AMPylase activity [GO:0070733]; ATP binding [GO:0005524]; metal ion binding [GO:0046872]	FUNCTION: Catalyzes the transfer of adenosine 5'-monophosphate (AMP) to Ser, Thr and Tyr residues of target proteins (AMPylation) (PubMed:30270044). May be a redox-active mitochondrial selenoprotein which interacts with a redox target protein (PubMed:24751718). {ECO:0000269|PubMed:24751718, ECO:0000269|PubMed:30270044}.
KIAA0586	Protein TALPID3	NA	FUNCTION: Required for ciliogenesis and sonic hedgehog/SHH signaling. Required for the centrosomal recruitment of RAB8A and for the targeting of centriole satellite proteins to centrosomes such as of PCM1. May play a role in early ciliogenesis in the disappearance of centriolar satellites that preceeds ciliary vesicle formation (PubMed:24421332). Involved in regulation of cell intracellular organization. Involved in regulation of cell polarity (By similarity). Required for asymmetrical localization of CEP120 to daughter centrioles (By similarity). {ECO:0000250|UniProtKB:E9PV87, ECO:0000250|UniProtKB:Q1G7G9, ECO:0000269|PubMed:24421332}.
IFIH1	Interferon-induced helicase C domain-containing protein 1 (EC 3.6.4.13) (Clinically amyopathic dermatomyositis autoantigen 140 kDa) (CADM-140 autoantigen) (Helicase with 2 CARD domains) (Helicard) (Interferon-induced with helicase C domain protein 1) (Melanoma differentiation-associated protein 5) (MDA-5) (Murabutide down-regulated protein) (RIG-I-like receptor 2) (RLR-2) (RNA helicase-DEAD box protein 116)	ATP binding [GO:0005524]; ATP hydrolysis activity [GO:0016887]; DNA binding [GO:0003677]; double-stranded RNA binding [GO:0003725]; identical protein binding [GO:0042802]; pattern recognition receptor activity [GO:0038187]; ribonucleoprotein complex binding [GO:0043021]; RNA binding [GO:0003723]; RNA helicase activity [GO:0003724]; single-stranded RNA binding [GO:0003727]; zinc ion binding [GO:0008270]	FUNCTION: Innate immune receptor which acts as a cytoplasmic sensor of viral nucleic acids and plays a major role in sensing viral infection and in the activation of a cascade of antiviral responses including the induction of type I interferons and pro-inflammatory cytokines (PubMed:28594402, PubMed:32169843, PubMed:33727702). Its ligands include mRNA lacking 2'-O-methylation at their 5' cap and long-dsRNA (>1 kb in length) (PubMed:22160685). Upon ligand binding it associates with mitochondria antiviral signaling protein (MAVS/IPS1) which activates the IKK-related kinases: TBK1 and IKBKE which phosphorylate interferon regulatory factors: IRF3 and IRF7 which in turn activate transcription of antiviral immunological genes, including interferons (IFNs); IFN-alpha and IFN-beta. Responsible for detecting the Picornaviridae family members such as encephalomyocarditis virus (EMCV), mengo encephalomyocarditis virus (ENMG), and rhinovirus (PubMed:28606988). Detects coronavirus SARS-CoV-2 (PubMed:33440148, PubMed:33514628). Can also detect other viruses such as dengue virus (DENV), west Nile virus (WNV), and reovirus. Also involved in antiviral signaling in response to viruses containing a dsDNA genome, such as vaccinia virus. Plays an important role in amplifying innate immune signaling through recognition of RNA metabolites that are produced during virus infection by ribonuclease L (RNase L). May play an important role in enhancing natural killer cell function and may be involved in growth inhibition and apoptosis in several tumor cell lines. {ECO:0000269|PubMed:14645903, ECO:0000269|PubMed:19211564, ECO:0000269|PubMed:19656871, ECO:0000269|PubMed:21217758, ECO:0000269|PubMed:21742966, ECO:0000269|PubMed:22160685, ECO:0000269|PubMed:28594402, ECO:0000269|PubMed:28606988, ECO:0000269|PubMed:29117565, ECO:0000269|PubMed:33440148, ECO:0000269|PubMed:33514628, ECO:0000269|PubMed:33727702}.
TPSD1	Tryptase delta (EC 3.4.21.59) (Delta-tryptase) (HmMCP-3-like tryptase III) (Mast cell mMCP-7-like) (Tryptase-3)	serine-type endopeptidase activity [GO:0004252]; serine-type peptidase activity [GO:0008236]	FUNCTION: Tryptase is the major neutral protease present in mast cells and is secreted upon the coupled activation-degranulation response of this cell type. {ECO:0000250}.
NACA2	Nascent polypeptide-associated complex subunit alpha-2 (Alpha-NAC-like) (Hom s 2.01) (Nascent polypeptide-associated complex subunit alpha-like) (NAC-alpha-like)	unfolded protein binding [GO:0051082]	FUNCTION: Prevents inappropriate targeting of non-secretory polypeptides to the endoplasmic reticulum (ER). Binds to nascent polypeptide chains as they emerge from the ribosome and blocks their interaction with the signal recognition particle (SRP), which normally targets nascent secretory peptides to the ER. Also reduces the inherent affinity of ribosomes for protein translocation sites in the ER membrane (M sites) (By similarity). {ECO:0000250}.
RHBG	Ammonium transporter Rh type B (Rhesus blood group family type B glycoprotein) (Rh family type B glycoprotein) (Rh type B glycoprotein)	ammonium channel activity [GO:0008519]; ankyrin binding [GO:0030506]; carbon dioxide transmembrane transporter activity [GO:0035379]	FUNCTION: Ammonium transporter involved in the maintenance of acid-base homeostasis. Transports ammonium and its related derivative methylammonium across the basolateral plasma membrane of epithelial cells likely contributing to renal transepithelial ammonia transport and ammonia metabolism. May transport either NH4(+) or NH3 ammonia species predominantly mediating an electrogenic NH4(+) transport (PubMed:15284342, PubMed:15929723, PubMed:24077989). May act as a CO2 channel providing for renal acid secretion (PubMed:24077989). {ECO:0000269|PubMed:15284342, ECO:0000269|PubMed:15929723, ECO:0000269|PubMed:24077989}.
OR51I2	Olfactory receptor 51I2 (Odorant receptor HOR5'beta12) (Olfactory receptor OR11-38)	G protein-coupled receptor activity [GO:0004930]; olfactory receptor activity [GO:0004984]	FUNCTION: Odorant receptor. {ECO:0000305}.
OR52D1	Olfactory receptor 52D1 (Odorant receptor HOR5'beta14) (Olfactory receptor OR11-43)	G protein-coupled receptor activity [GO:0004930]; olfactory receptor activity [GO:0004984]	FUNCTION: Odorant receptor. {ECO:0000305}.
PABPC3	Polyadenylate-binding protein 3 (PABP-3) (Poly(A)-binding protein 3) (Testis-specific poly(A)-binding protein)	mRNA 3'-UTR binding [GO:0003730]; poly(A) binding [GO:0008143]; poly(U) RNA binding [GO:0008266]	FUNCTION: Binds the poly(A) tail of mRNA. May be involved in cytoplasmic regulatory processes of mRNA metabolism. Binds poly(A) with a slightly lower affinity as compared to PABPC1.
NOD2	Nucleotide-binding oligomerization domain-containing protein 2 (Caspase recruitment domain-containing protein 15) (Inflammatory bowel disease protein 1)	actin binding [GO:0003779]; ADP binding [GO:0043531]; ATP binding [GO:0005524]; CARD domain binding [GO:0050700]; enzyme binding [GO:0019899]; Hsp70 protein binding [GO:0030544]; Hsp90 protein binding [GO:0051879]; muramyl dipeptide binding [GO:0032500]; pattern recognition receptor activity [GO:0038187]; peptidoglycan binding [GO:0042834]; protein kinase binding [GO:0019901]; protein-containing complex binding [GO:0044877]; ubiquitin binding [GO:0043130]	FUNCTION: Pattern recognition receptor (PRR) that detects bacterial peptidoglycan fragments and other danger signals and plays an important role in gastrointestinal immunity (PubMed:12514169, PubMed:12527755, PubMed:12626759, PubMed:15044951, PubMed:15998797, PubMed:27283905, PubMed:27748583, PubMed:31649195). Specifically activated by muramyl dipeptide (MDP), a fragment of bacterial peptidoglycan found in every bacterial peptidoglycan type (PubMed:12514169, PubMed:12527755, PubMed:12626759, PubMed:12871942, PubMed:15044951, PubMed:15198989, PubMed:15998797, PubMed:22857257, PubMed:23322906, PubMed:27748583, PubMed:36002575). NOD2 specifically recognizes and binds 6-O-phospho-MDP, the phosphorylated form of MDP, which is generated by NAGK (PubMed:36002575). 6-O-phospho-MDP-binding triggers oligomerization that facilitates the binding and subsequent activation of the proximal adapter receptor-interacting RIPK2 (PubMed:11087742, PubMed:17355968, PubMed:21887730, PubMed:23806334, PubMed:28436939). Following recruitment, RIPK2 undergoes 'Met-1'- (linear) and 'Lys-63'-linked polyubiquitination by E3 ubiquitin-protein ligases XIAP, BIRC2, BIRC3 and the LUBAC complex, becoming a scaffolding protein for downstream effectors, triggering activation of the NF-kappa-B and MAP kinases signaling (PubMed:11087742, PubMed:12514169, PubMed:12626759, PubMed:15198989, PubMed:21887730, PubMed:23322906, PubMed:23806334, PubMed:28436939). This in turn leads to the transcriptional activation of hundreds of genes involved in immune response (PubMed:15198989). Its ability to detect bacterial MDP plays a central role in maintaining the equilibrium between intestinal microbiota and host immune responses to control inflammation (By similarity). An imbalance in this relationship results in dysbiosis, whereby pathogenic bacteria prevail on commensals, causing damage in the intestinal epithelial barrier as well as allowing bacterial invasion and inflammation (By similarity). Acts as a regulator of appetite by sensing MDP in a subset of brain neurons: microbiota-derived MDP reach the brain, where they bind and activate NOD2 in inhibitory hypothalamic neurons, decreasing neuronal activity, thereby regulating satiety and body temperature (By similarity). NOD2-dependent MDP-sensing of bacterial cell walls in the intestinal epithelial compartment contributes to sustained postnatal growth upon undernutrition (By similarity). Also plays a role in antiviral response by acting as a sensor of single-stranded RNA (ssRNA) from viruses: upon ssRNA-binding, interacts with MAVS, leading to activation of interferon regulatory factor-3/IRF3 and expression of type I interferon (PubMed:19701189). Also acts as a regulator of autophagy in dendritic cells via its interaction with ATG16L1, possibly by recruiting ATG16L1 at the site of bacterial entry (PubMed:20637199). NOD2 activation in the small intestine crypt also contributes to intestinal stem cells survival and function: acts by promoting mitophagy via its association with ATG16L1 (By similarity). In addition to its main role in innate immunity, also regulates the adaptive immune system by acting as regulator of helper T-cell and regulatory T-cells (Tregs) (By similarity). Besides recognizing pathogens, also involved in the endoplasmic reticulum stress response: acts by sensing and binding to the cytosolic metabolite sphingosine-1-phosphate generated in response to endoplasmic reticulum stress, initiating an inflammation process that leads to activation of the NF-kappa-B and MAP kinases signaling (PubMed:27007849, PubMed:33942347). May also be involved in NLRP1 activation following activation by MDP, leading to CASP1 activation and IL1B release in macrophages (PubMed:18511561). {ECO:0000250|UniProtKB:Q8K3Z0, ECO:0000269|PubMed:11087742, ECO:0000269|PubMed:12514169, ECO:0000269|PubMed:12527755, ECO:0000269|PubMed:12626759, ECO:0000269|PubMed:12871942, ECO:0000269|PubMed:15044951, ECO:0000269|PubMed:15198989, ECO:0000269|PubMed:15998797, ECO:0000269|PubMed:17355968, ECO:0000269|PubMed:18511561, ECO:0000269|PubMed:19701189, ECO:0000269|PubMed:20637199, ECO:0000269|PubMed:21887730, ECO:0000269|PubMed:22857257, ECO:0000269|PubMed:23322906, ECO:0000269|PubMed:23806334, ECO:0000269|PubMed:27007849, ECO:0000269|PubMed:27283905, ECO:0000269|PubMed:27748583, ECO:0000269|PubMed:28436939, ECO:0000269|PubMed:31649195, ECO:0000269|PubMed:33942347, ECO:0000269|PubMed:36002575}.; FUNCTION: [Isoform 2]: Acts as a pattern recognition receptor (PRR); able to activate NF-kappa-B. {ECO:0000269|PubMed:11087742}.; FUNCTION: [Isoform 3]: Can activate NF-kappa-B in a muramyl dipeptide (MDP)-independent manner. {ECO:0000269|PubMed:20698950}.
MMP20	Matrix metalloproteinase-25 (MMP-25) (EC 3.4.24.-) (Leukolysin) (Membrane-type matrix metalloproteinase 6) (MT-MMP 6) (MTMMP6) (Membrane-type-6 matrix metalloproteinase) (MT6-MMP) (MT6MMP)	metalloendopeptidase activity [GO:0004222]; zinc ion binding [GO:0008270]	FUNCTION: May activate progelatinase A.
OTOR	Otoraplin (Fibrocyte-derived protein) (Melanoma inhibitory activity-like protein)	NA	NA
ST6GALNAC1	Alpha-N-acetylgalactosaminide alpha-2,6-sialyltransferase 1 (EC 2.4.3.3) (GalNAc alpha-2,6-sialyltransferase I) (ST6GalNAc I) (ST6GalNAc-I) (ST6GalNAcI) (hST6GalNAc-I) (Sialyltransferase 7A) (SIAT7-A)	alpha-N-acetylgalactosaminide alpha-2,6-sialyltransferase activity [GO:0001665]; sialyltransferase activity [GO:0008373]	FUNCTION: Protein sialyltransferase specifically expressed in goblet cells that plays a key role in intestinal host-commensal homeostasis (PubMed:35303419). Conjugates sialic acid with an alpha-2-6 linkage to N-acetylgalactosamine (GalNAc) glycan chains linked to serine or threonine in glycoproteins (PubMed:16319059, PubMed:35303419). Catalyzes the formation of the sialyl-Tn (S-Tn) antigen, an antigen found in intestinal goblet cells, as well as ulcerative colitis (UC) and various cancers (PubMed:16319059, PubMed:35303419). Protein sialylation in globlet cells is essential for mucus integrity and is required to protect the intestinal mucus against excessive bacterial proteolytic degradation (PubMed:35303419). {ECO:0000269|PubMed:16319059, ECO:0000269|PubMed:35303419}.
ZNFX1	NFX1-type zinc finger-containing protein 1	helicase activity [GO:0004386]; RNA binding [GO:0003723]; zinc ion binding [GO:0008270]	FUNCTION: RNA-binding protein that initiates the antiviral response and is required to restrict the replication of RNA viruses (PubMed:33872655). Acts as a double-stranded RNA (dsRNA) sensor that recognizes viral RNA and then interacts with MAVS to initiate the type I interferon response (By similarity). Also required for immunity against some bacteria, such as mycobacteria (PubMed:33876776). {ECO:0000250|UniProtKB:Q8R151, ECO:0000269|PubMed:33872655, ECO:0000269|PubMed:33876776}.
MYO1A	Unconventional myosin-Ia (Brush border myosin I) (BBM-I) (BBMI) (Myosin I heavy chain) (MIHC)	actin filament binding [GO:0051015]; ATP binding [GO:0005524]; calmodulin binding [GO:0005516]; microfilament motor activity [GO:0000146]	FUNCTION: Involved in directing the movement of organelles along actin filaments. {ECO:0000305}.
TAP2	SEC14-like protein 3 (Tocopherol-associated protein 2)	lipid binding [GO:0008289]	FUNCTION: Probable hydrophobic ligand-binding protein; may play a role in the transport of hydrophobic ligands like tocopherol, squalene and phospholipids.
RIMBP3	RIMS-binding protein 3A (RIM-BP3.A) (RIMS-binding protein 3.1) (RIM-BP3.1)	benzodiazepine receptor binding [GO:0030156]	FUNCTION: Probable component of the manchette, a microtubule-based structure which plays a key role in sperm head morphogenesis during late stages of sperm development. {ECO:0000250|UniProtKB:Q3V0F0}.
ADAMTS5	A disintegrin and metalloproteinase with thrombospondin motifs 5 (ADAM-TS 5) (ADAM-TS5) (ADAMTS-5) (EC 3.4.24.-) (A disintegrin and metalloproteinase with thrombospondin motifs 11) (ADAM-TS 11) (ADAMTS-11) (ADMP-2) (Aggrecanase-2)	endopeptidase activity [GO:0004175]; extracellular matrix binding [GO:0050840]; heparin binding [GO:0008201]; identical protein binding [GO:0042802]; integrin binding [GO:0005178]; metalloendopeptidase activity [GO:0004222]; metallopeptidase activity [GO:0008237]; peptidase activity [GO:0008233]; zinc ion binding [GO:0008270]	FUNCTION: Metalloproteinase that plays an important role in connective tissue organization, development, inflammation and cell migration. Extracellular matrix (ECM) degrading enzyme that show proteolytic activity toward the hyalectan group of chondroitin sulfate proteoglycans (CSPGs) including ACAN, VCAN, BCAN and NCAN (PubMed:16133547, PubMed:18992360). Cleavage within the hyalectans occurs at Glu-Xaa recognition motifs. Plays a role in embryonic development, including limb and cardiac morphogenesis, and skeletal muscle development through its VCAN remodeling properties. Cleaves VCAN in the pericellular matrix surrounding myoblasts, facilitating myoblast contact and fusion which is required for skeletal muscle development and regeneration (By similarity). Participates in development of brown adipose tissue and browning of white adipose tissue (By similarity). Plays an important role for T-lymphocyte migration from draining lymph nodes following viral infection. {ECO:0000250|UniProtKB:Q9R001, ECO:0000269|PubMed:16133547, ECO:0000269|PubMed:18992360}.
MOK	MAPK/MAK/MRK overlapping kinase (EC 2.7.11.22) (MOK protein kinase) (Renal tumor antigen 1) (RAGE-1)	ATP binding [GO:0005524]; cyclin-dependent protein serine/threonine kinase activity [GO:0004693]; metal ion binding [GO:0046872]; protein kinase activity [GO:0004672]; protein serine kinase activity [GO:0106310]; protein serine/threonine kinase activity [GO:0004674]	FUNCTION: Able to phosphorylate several exogenous substrates and to undergo autophosphorylation. Negatively regulates cilium length in a cAMP and mTORC1 signaling-dependent manner. {ECO:0000250|UniProtKB:Q9WVS4}.
