SYMBOL	Protein.names	Gene.Ontology..molecular.function.	Function..CC.
OR51F1	Olfactory receptor 51F1	G protein-coupled receptor activity [GO:0004930]; olfactory receptor activity [GO:0004984]	FUNCTION: Odorant receptor. {ECO:0000305}.
COL6A5	Collagen alpha-5(VI) chain (Collagen alpha-1(XXIX) chain) (von Willebrand factor A domain-containing protein 4)	extracellular matrix structural constituent conferring tensile strength [GO:0030020]	FUNCTION: Collagen VI acts as a cell-binding protein. {ECO:0000250}.
POLR3A	DNA-directed RNA polymerase III subunit RPC1 (RNA polymerase III subunit C1) (EC 2.7.7.6) (DNA-directed RNA polymerase III largest subunit) (DNA-directed RNA polymerase III subunit A) (RNA polymerase III 155 kDa subunit) (RPC155) (RNA polymerase III subunit C160)	chromatin binding [GO:0003682]; DNA binding [GO:0003677]; DNA-directed 5'-3' RNA polymerase activity [GO:0003899]; DNA/RNA hybrid binding [GO:0071667]; magnesium ion binding [GO:0000287]; zinc ion binding [GO:0008270]	FUNCTION: Catalytic core component of RNA polymerase III (Pol III), a DNA-dependent RNA polymerase which synthesizes small non-coding RNAs using the four ribonucleoside triphosphates as substrates. Synthesizes 5S rRNA, snRNAs, tRNAs and miRNAs from at least 500 distinct genomic loci (PubMed:19609254, PubMed:19631370, PubMed:20413673, PubMed:33335104, PubMed:33558764, PubMed:33558766, PubMed:34675218, PubMed:35637192, PubMed:9331371). Pol III-mediated transcription cycle proceeds through transcription initiation, transcription elongation and transcription termination stages. During transcription initiation, Pol III is recruited to DNA promoters type I, II or III with the help of general transcription factors and other specific initiation factors. Once the polymerase has escaped from the promoter it enters the elongation phase during which RNA is actively polymerized, based on complementarity with the template DNA strand. Transcription termination involves the release of the RNA transcript and polymerase from the DNA (PubMed:20413673, PubMed:33335104, PubMed:33558764, PubMed:33558766, PubMed:33674783, PubMed:34675218). Forms Pol III active center together with the second largest subunit POLR3B/RPC2. Appends one nucleotide at a time to the 3' end of the nascent RNA, with POLR3A/RPC1 contributing a Mg(2+)-coordinating DxDGD motif, and POLR3B/RPC2 participating in the coordination of a second Mg(2+) ion and providing lysine residues believed to facilitate Watson-Crick base pairing between the incoming nucleotide and template base. Typically, Mg(2+) ions direct a 5' nucleoside triphosphate to form a phosphodiester bond with the 3' hydroxyl of the preceding nucleotide of the nascent RNA, with the elimination of pyrophosphate (PubMed:19609254, PubMed:20413673, PubMed:33335104, PubMed:33558764, PubMed:33674783, PubMed:34675218, PubMed:9331371). Pol III plays a key role in sensing and limiting infection by intracellular bacteria and DNA viruses. Acts as a nuclear and cytosolic DNA sensor involved in innate immune response. Can sense non-self dsDNA that serves as template for transcription into dsRNA. The non-self RNA polymerase III transcripts, such as Epstein-Barr virus-encoded RNAs (EBERs) induce type I interferon and NF-kappa-B through the RIG-I pathway. {ECO:0000250, ECO:0000269|PubMed:19609254, ECO:0000269|PubMed:19631370, ECO:0000269|PubMed:20413673, ECO:0000269|PubMed:33335104, ECO:0000269|PubMed:33558764, ECO:0000269|PubMed:33558766, ECO:0000269|PubMed:33674783, ECO:0000269|PubMed:34675218, ECO:0000269|PubMed:35637192, ECO:0000269|PubMed:9331371}.
SLC22A1	Solute carrier family 22 member 1 (Organic cation transporter 1) (hOCT1)	(R)-carnitine transmembrane transporter activity [GO:1901235]; acetylcholine transmembrane transporter activity [GO:0005277]; dopamine:sodium symporter activity [GO:0005330]; identical protein binding [GO:0042802]; monoamine transmembrane transporter activity [GO:0008504]; neurotransmitter transmembrane transporter activity [GO:0005326]; norepinephrine:sodium symporter activity [GO:0005334]; organic anion transmembrane transporter activity [GO:0008514]; organic cation transmembrane transporter activity [GO:0015101]; prostaglandin transmembrane transporter activity [GO:0015132]; putrescine transmembrane transporter activity [GO:0015489]; pyrimidine nucleoside transmembrane transporter activity [GO:0015214]; quaternary ammonium group transmembrane transporter activity [GO:0015651]; spermidine transmembrane transporter activity [GO:0015606]; thiamine transmembrane transporter activity [GO:0015234]; toxin transmembrane transporter activity [GO:0019534]; xenobiotic transmembrane transporter activity [GO:0042910]	FUNCTION: Electrogenic voltage-dependent transporter that mediates the transport of a variety of organic cations such as endogenous bioactive amines, cationic drugs and xenobiotics (PubMed:11388889, PubMed:11408531, PubMed:12439218, PubMed:12719534, PubMed:15389554, PubMed:16263091, PubMed:16272756, PubMed:16581093, PubMed:19536068, PubMed:21128598, PubMed:23680637, PubMed:24961373, PubMed:34040533, PubMed:9187257, PubMed:9260930, PubMed:9655880). Functions as a pH- and Na(+)-independent, bidirectional transporter (By similarity). Cation cellular uptake or release is driven by the electrochemical potential (i.e. membrane potential and concentration gradient) and substrate selectivity (By similarity). Hydrophobicity is a major requirement for recognition in polyvalent substrates and inhibitors (By similarity). Primarily expressed at the basolateral membrane of hepatocytes and proximal tubules and involved in the uptake and disposition of cationic compounds by hepatic and renal clearance from the blood flow (By similarity). Most likely functions as an uptake carrier in enterocytes contributing to the intestinal elimination of organic cations from the systemic circulation (PubMed:16263091). Transports endogenous monoamines such as N-1-methylnicotinamide (NMN), guanidine, histamine, neurotransmitters dopamine, serotonin and adrenaline (PubMed:12439218, PubMed:24961373, PubMed:35469921, PubMed:9260930). Also transports natural polyamines such as spermidine, agmatine and putrescine at low affinity, but relatively high turnover (PubMed:21128598). Involved in the hepatic uptake of vitamin B1/thiamine, hence regulating hepatic lipid and energy metabolism (PubMed:24961373). Mediates the bidirectional transport of acetylcholine (ACh) at the apical membrane of ciliated cell in airway epithelium, thereby playing a role in luminal release of ACh from bronchial epithelium (PubMed:15817714). Transports dopaminergic neuromodulators cyclo(his-pro) and salsolinol with lower efficency (PubMed:17460754). Also capable of transporting non-amine endogenous compounds such as prostaglandin E2 (PGE2) and prostaglandin F2-alpha (PGF2-alpha) (PubMed:11907186). May contribute to the transport of cationic compounds in testes across the blood-testis-barrier (Probable). Also involved in the uptake of xenobiotics tributylmethylammonium (TBuMA), quinidine, N-methyl-quinine (NMQ), N-methyl-quinidine (NMQD) N-(4,4-azo-n-pentyl)-quinuclidine (APQ), azidoprocainamide methoiodide (AMP), N-(4,4-azo-n-pentyl)-21-deoxyajmalinium (APDA) and 4-(4-(dimethylamino)styryl)-N-methylpyridinium (ASP) (PubMed:11408531, PubMed:15389554, PubMed:35469921, PubMed:9260930). {ECO:0000250|UniProtKB:O08966, ECO:0000250|UniProtKB:Q63089, ECO:0000269|PubMed:11388889, ECO:0000269|PubMed:11408531, ECO:0000269|PubMed:11907186, ECO:0000269|PubMed:12439218, ECO:0000269|PubMed:12719534, ECO:0000269|PubMed:15389554, ECO:0000269|PubMed:15817714, ECO:0000269|PubMed:16263091, ECO:0000269|PubMed:16272756, ECO:0000269|PubMed:16581093, ECO:0000269|PubMed:17460754, ECO:0000269|PubMed:19536068, ECO:0000269|PubMed:21128598, ECO:0000269|PubMed:23680637, ECO:0000269|PubMed:24961373, ECO:0000269|PubMed:34040533, ECO:0000269|PubMed:35469921, ECO:0000269|PubMed:9187257, ECO:0000269|PubMed:9260930, ECO:0000269|PubMed:9655880, ECO:0000305|PubMed:35307651}.; FUNCTION: [Isoform 1]: Mediates the uptake of 1-methyl-4-phenylpyridinium (MPP(+)). {ECO:0000269|PubMed:11388889}.; FUNCTION: [Isoform 2]: Not able to uptake 1-methyl-4-phenylpyridinium (MPP(+)). {ECO:0000269|PubMed:11388889}.; FUNCTION: [Isoform 3]: Not able to uptake 1-methyl-4-phenylpyridinium (MPP(+)). {ECO:0000269|PubMed:11388889}.; FUNCTION: [Isoform 4]: Not able to uptake 1-methyl-4-phenylpyridinium (MPP(+)). {ECO:0000269|PubMed:11388889}.
TLR5	Toll-like receptor 5 (Toll/interleukin-1 receptor-like protein 3)	interleukin-1 receptor binding [GO:0005149]; pattern recognition receptor activity [GO:0038187]; signaling receptor activity [GO:0038023]; transmembrane signaling receptor activity [GO:0004888]	FUNCTION: Pattern recognition receptor (PRR) located on the cell surface that participates in the activation of innate immunity and inflammatory response (PubMed:11323673, PubMed:18490781). Recognizes small molecular motifs named pathogen-associated molecular pattern (PAMPs) expressed by pathogens and microbe-associated molecular patterns (MAMPs) usually expressed by resident microbiota (PubMed:29934223). Upon ligand binding such as bacterial flagellins, recruits intracellular adapter proteins MYD88 and TRIF leading to NF-kappa-B activation, cytokine secretion and induction of the inflammatory response (PubMed:11489966, PubMed:20855887). Plays thereby an important role in the relationship between the intestinal epithelium and enteric microbes and contributes to the gut microbiota composition throughout life (By similarity). {ECO:0000250|UniProtKB:Q9JLF7, ECO:0000269|PubMed:11323673, ECO:0000269|PubMed:11489966, ECO:0000269|PubMed:18490781, ECO:0000269|PubMed:20855887, ECO:0000269|PubMed:29934223}.
MMP20	Matrix metalloproteinase-20 (MMP-20) (EC 3.4.24.-) (Enamel metalloproteinase) (Enamelysin)	metalloendopeptidase activity [GO:0004222]; zinc ion binding [GO:0008270]	FUNCTION: Degrades amelogenin, the major protein component of the enamel matrix and two of the macromolecules characterizing the cartilage extracellular matrix: aggrecan and the cartilage oligomeric matrix protein (COMP). May play a central role in tooth enamel formation. Cleaves aggrecan at the '360-Asn-|-Phe-361' site. {ECO:0000269|PubMed:10922468, ECO:0000269|PubMed:9398237}.
POLQ	DNA polymerase theta (DNA polymerase eta) [Includes: Helicase POLQ (EC 3.6.4.12); DNA polymerase POLQ (EC 2.7.7.7) (RNA-directed DNA polymerase POLQ) (EC 2.7.7.49)]	5'-deoxyribose-5-phosphate lyase activity [GO:0051575]; ATP binding [GO:0005524]; ATP hydrolysis activity [GO:0016887]; chromatin binding [GO:0003682]; damaged DNA binding [GO:0003684]; DNA helicase activity [GO:0003678]; DNA-directed DNA polymerase activity [GO:0003887]; endonuclease activity [GO:0004519]; identical protein binding [GO:0042802]; magnesium ion binding [GO:0000287]; RNA-directed DNA polymerase activity [GO:0003964]; single-stranded DNA helicase activity [GO:0017116]	FUNCTION: Low-fidelity DNA polymerase with a helicase activity that promotes microhomology-mediated end-joining (MMEJ), an alternative non-homologous end-joining (NHEJ) machinery required to repair double-strand breaks in DNA during mitosis (PubMed:14576298, PubMed:18503084, PubMed:24648516, PubMed:25642963, PubMed:25643323, PubMed:25775267, PubMed:26636256, PubMed:27311885, PubMed:27591252, PubMed:30655289, PubMed:31562312, PubMed:32873648, PubMed:34140467, PubMed:34179826, PubMed:36455556, PubMed:37440612, PubMed:37674080). MMEJ is an error-prone repair pathway that produces deletions of sequences from the strand being repaired and promotes genomic rearrangements, such as telomere fusions, some of them leading to cellular transformation (PubMed:25642963, PubMed:25643323, PubMed:25775267, PubMed:27311885, PubMed:27591252, PubMed:31562312, PubMed:32873648). MMEJ is required during mitosis to repair persistent double-strand breaks that originate in S-phase (PubMed:37440612, PubMed:37674080). Although error-prone, MMEJ protects against chromosomal instability and tumorigenesis (By similarity). The polymerase acts by binding directly the 2 ends of resected double-strand breaks, allowing microhomologous sequences in the overhangs to form base pairs (PubMed:25643323, PubMed:25775267, PubMed:27311885, PubMed:27591252). It then extends each strand from the base-paired region using the opposing overhang as a template (PubMed:25643323, PubMed:25775267, PubMed:27311885, PubMed:27591252). Requires partially resected DNA containing 2 to 6 base pairs of microhomology to perform MMEJ (PubMed:25643323, PubMed:25775267, PubMed:27311885, PubMed:27591252). The polymerase lacks proofreading activity and is highly promiscuous: unlike most polymerases, promotes extension of ssDNA and partial ssDNA (pssDNA) substrates (PubMed:18503084, PubMed:21050863, PubMed:22135286). When the ends of a break do not contain terminal microhomology must identify embedded complementary sequences through a scanning step (PubMed:32234782). Also acts as a DNA helicase, promoting dissociation of the replication protein A complex (RPA/RP-A), composed of RPA1, RPA2 and RPA3, from resected double-strand breaks to allow their annealing and subsequent joining by MMEJ (PubMed:36455556). Removal of RPA/RP-A complex proteins prevents RAD51 accumulation at resected ends, thereby inhibiting homology-recombination repair (HR) pathway (PubMed:25642963, PubMed:28695890). Also shows RNA-directed DNA polymerase activity to mediate DNA repair in vitro; however this activity needs additional evidence in vivo (PubMed:34117057). May also have lyase activity (PubMed:19188258). Involved in somatic hypermutation of immunoglobulin genes, a process that requires the activity of DNA polymerases to ultimately introduce mutations at both A/T and C/G base pairs (By similarity). POLQ-mediated end joining activity is involved in random integration of exogenous DNA hampers (PubMed:28695890). {ECO:0000250|UniProtKB:Q8CGS6, ECO:0000269|PubMed:14576298, ECO:0000269|PubMed:18503084, ECO:0000269|PubMed:19188258, ECO:0000269|PubMed:21050863, ECO:0000269|PubMed:22135286, ECO:0000269|PubMed:24648516, ECO:0000269|PubMed:25642963, ECO:0000269|PubMed:25643323, ECO:0000269|PubMed:25775267, ECO:0000269|PubMed:26636256, ECO:0000269|PubMed:27311885, ECO:0000269|PubMed:27591252, ECO:0000269|PubMed:28695890, ECO:0000269|PubMed:30655289, ECO:0000269|PubMed:31562312, ECO:0000269|PubMed:32234782, ECO:0000269|PubMed:32873648, ECO:0000269|PubMed:34117057, ECO:0000269|PubMed:34140467, ECO:0000269|PubMed:34179826, ECO:0000269|PubMed:36455556, ECO:0000269|PubMed:37440612, ECO:0000269|PubMed:37674080}.
PRKRA	Interferon-inducible double-stranded RNA-dependent protein kinase activator A (PKR-associated protein X) (PKR-associating protein X) (Protein activator of the interferon-induced protein kinase) (Protein kinase, interferon-inducible double-stranded RNA-dependent activator)	double-stranded RNA binding [GO:0003725]; enzyme activator activity [GO:0008047]; enzyme binding [GO:0019899]; identical protein binding [GO:0042802]; pre-miRNA binding [GO:0070883]; protein homodimerization activity [GO:0042803]; protein kinase activator activity [GO:0030295]; RNA binding [GO:0003723]; siRNA binding [GO:0035197]	FUNCTION: Activates EIF2AK2/PKR in the absence of double-stranded RNA (dsRNA), leading to phosphorylation of EIF2S1/EFI2-alpha and inhibition of translation and induction of apoptosis. Required for siRNA production by DICER1 and for subsequent siRNA-mediated post-transcriptional gene silencing. Does not seem to be required for processing of pre-miRNA to miRNA by DICER1. Promotes UBC9-p53/TP53 association and sumoylation and phosphorylation of p53/TP53 at 'Lys-386' at 'Ser-392' respectively and enhances its activity in a EIF2AK2/PKR-dependent manner (By similarity). {ECO:0000250, ECO:0000269|PubMed:10336432, ECO:0000269|PubMed:11238927, ECO:0000269|PubMed:16424907, ECO:0000269|PubMed:16982605, ECO:0000269|PubMed:17452327, ECO:0000269|PubMed:9687506}.
KRT37	Keratin, type I cuticular Ha7 (Hair keratin, type I Ha7) (Keratin-37) (K37)	structural molecule activity [GO:0005198]	NA
CNTN5	Contactin-5 (Neural recognition molecule NB-2) (hNB-2)	cell-cell adhesion mediator activity [GO:0098632]	FUNCTION: Contactins mediate cell surface interactions during nervous system development. Has some neurite outgrowth-promoting activity in the cerebral cortical neurons but not in hippocampal neurons. Probably involved in neuronal activity in the auditory system (By similarity). {ECO:0000250}.
DDHD2	Triacylglycerol hydrolase DDHD2 (TAG hydrolase) (EC 3.1.1.3) (DDHD domain-containing protein 2) (KIAA0725p) (Phospholipase DDHD2) (EC 3.1.1.-) (SAM, WWE and DDHD domain-containing protein 1) (Triglyceride hydrolase DDHD2) (Triglyceride lipase)	metal ion binding [GO:0046872]; triacylglycerol lipase activity [GO:0004806]	FUNCTION: Diacylglycerol (DAG) and triacylglycerol (TAG) lipase required for proper lipid homeostasis in the central nervous system (PubMed:29278326, PubMed:37832604). It cooperates with PNPLA2/ATGL in neuronal TAG catabolism and hydrolyzes sn-1,3 DAG downstream of PNPLA2/ATGL (By similarity). In vitro, it also acts as a phospholipase that hydrolyzes preferentially phosphatidic acids, including 1,2-dioleoyl-sn-phosphatidic acid, phosphatidylcholine and phosphatidylethanolamine. Specifically binds to phosphatidylinositol 3-phosphate (PI(3)P), phosphatidylinositol 4-phosphate (PI(4)P), phosphatidylinositol 5-phosphate (PI(5)P) and possibly phosphatidylinositol 4,5-bisphosphate (PI(4,5)P2). May be involved in the maintenance of the endoplasmic reticulum and/or Golgi structures. May regulate the transport between Golgi apparatus and plasma membrane. {ECO:0000250|UniProtKB:Q80Y98, ECO:0000269|PubMed:11788596, ECO:0000269|PubMed:20932832, ECO:0000269|PubMed:22922100, ECO:0000269|PubMed:29278326, ECO:0000269|PubMed:37832604}.
CFB	Complement factor B (EC 3.4.21.47) (C3/C5 convertase) (Glycine-rich beta glycoprotein) (GBG) (PBF2) (Properdin factor B) [Cleaved into: Complement factor B Ba fragment; Complement factor B Bb fragment]	complement binding [GO:0001848]; serine-type endopeptidase activity [GO:0004252]	FUNCTION: Factor B which is part of the alternate pathway of the complement system is cleaved by factor D into 2 fragments: Ba and Bb. Bb, a serine protease, then combines with complement factor 3b to generate the C3 or C5 convertase. It has also been implicated in proliferation and differentiation of preactivated B-lymphocytes, rapid spreading of peripheral blood monocytes, stimulation of lymphocyte blastogenesis and lysis of erythrocytes. Ba inhibits the proliferation of preactivated B-lymphocytes.
OAS1	2'-5'-oligoadenylate synthase 1 ((2-5')oligo(A) synthase 1) (2-5A synthase 1) (EC 2.7.7.84) (E18/E16) (p46/p42 OAS)	2'-5'-oligoadenylate synthetase activity [GO:0001730]; ATP binding [GO:0005524]; double-stranded RNA binding [GO:0003725]; metal ion binding [GO:0046872]	FUNCTION: Interferon-induced, dsRNA-activated antiviral enzyme which plays a critical role in cellular innate antiviral response (PubMed:34581622). In addition, it may also play a role in other cellular processes such as apoptosis, cell growth, differentiation and gene regulation. Synthesizes higher oligomers of 2'-5'-oligoadenylates (2-5A) from ATP which then bind to the inactive monomeric form of ribonuclease L (RNase L) leading to its dimerization and subsequent activation. Activation of RNase L leads to degradation of cellular as well as viral RNA, resulting in the inhibition of protein synthesis, thus terminating viral replication (PubMed:34145065, PubMed:34581622). Can mediate the antiviral effect via the classical RNase L-dependent pathway or an alternative antiviral pathway independent of RNase L. The secreted form displays antiviral effect against vesicular stomatitis virus (VSV), herpes simplex virus type 2 (HSV-2), and encephalomyocarditis virus (EMCV) and stimulates the alternative antiviral pathway independent of RNase L. {ECO:0000269|PubMed:12799444, ECO:0000269|PubMed:18931074, ECO:0000269|PubMed:19923450, ECO:0000269|PubMed:23319625, ECO:0000269|PubMed:34145065, ECO:0000269|PubMed:34581622}.; FUNCTION: [Isoform p46]: When prenylated at C-terminal, acts as a double-stranded RNA (dsRNA) sensor specifically targeted to membranous replicative organelles in SARS coronavirus-2/SARS-CoV-2 infected cells where it binds to dsRNA structures in the SARS-CoV-2 5'-UTR and initiates a potent block to SARS-CoV-2 replication. Recognizes short stretches of dsRNA and activates RNase L. The binding is remarkably specific, with two conserved stem loops in the SARS-CoV-2 5'- untranslated region (UTR) constituting the principal viral target (PubMed:34581622). The same mechanism is necessary to initiate a block to cardiovirus EMCV (PubMed:34581622). {ECO:0000269|PubMed:34581622}.; FUNCTION: [Isoform p42]: Not prenylated at C-terminal, is diffusely localized and unable to initiate a detectable block to SARS-CoV-2 replication. {ECO:0000269|PubMed:34581622}.
EGF	Pro-epidermal growth factor (EGF) [Cleaved into: Epidermal growth factor (Urogastrone)]	calcium ion binding [GO:0005509]; epidermal growth factor receptor binding [GO:0005154]; growth factor activity [GO:0008083]; guanyl-nucleotide exchange factor activity [GO:0005085]; receptor ligand activity [GO:0048018]; transmembrane receptor protein tyrosine kinase activator activity [GO:0030297]	FUNCTION: EGF stimulates the growth of various epidermal and epithelial tissues in vivo and in vitro and of some fibroblasts in cell culture. Magnesiotropic hormone that stimulates magnesium reabsorption in the renal distal convoluted tubule via engagement of EGFR and activation of the magnesium channel TRPM6. Can induce neurite outgrowth in motoneurons of the pond snail Lymnaea stagnalis in vitro (PubMed:10964941). {ECO:0000269|PubMed:10964941, ECO:0000269|PubMed:17671655}.
